<?xml version="1.0" encoding="utf-8"?>
<xs:schema xmlns:xs="http://www.w3.org/2001/XMLSchema">

  <xs:attribute name="name" type="xs:string"/>

  <!--complex elements-->
  <xs:element name="string">
    <xs:complexType>
      <xs:simpleContent>
        <xs:extension base="xs:string">
          <xs:attribute ref="name" />
        </xs:extension>
      </xs:simpleContent>
    </xs:complexType>
  </xs:element>



  <xs:element name="strings">
    <xs:complexType>
      <xs:sequence>
        <xs:element ref="string" minOccurs="1" maxOccurs="unbounded"/>
      </xs:sequence>
      <xs:anyAttribute processContents="skip"/>
    </xs:complexType>
  </xs:element>
</xs:schema>


